ID,Language_ID,Parameter_ID,Gloss_ID,Tag_ID,Form,Segments,Comment,Source
4185,2,1087,,,rota:jo:,r o t a: j o:,,
4186,2,1087,,,rota:jeti,r o t a: j e t i,,
4187,1,1088,186,11,ro:bus,r o: b u s,,
4188,1,1088,186,12,ro:bi:,r o: b i:,,
4189,2,1088,186,,rouðos,r o u ð o s,,
4190,2,1088,186,,rouði:,r o u ð i:,,
4191,1,1089,187,15,ro:bur,r o: b u r,,
4192,1,1089,187,16,ro:boris,r o: b o r i s,,
4193,2,1089,187,,rouβos,r o u β o s,,
4194,2,1089,187,,rouβozes,r o u β o z e s,,
4195,1,1090,,1,ro:do:,r o: d o:,,
4196,1,1090,,2,ro:dit,r o: d i t,,
4197,2,1090,,,wro:do:,w r o: d o:,,
4198,2,1090,,,wro:deti,w r o: d e t i,,
4199,1,1091,,5,ro:s,r o: s,,
4200,1,1091,,6,ro:ris,r o: r i s,,
4201,2,1091,,,ro:s,r o: s,,
4202,2,1091,,,ro:ses,r o: s e s,,
4203,1,1092,,7,rubeo:,r u b e o:,,
4204,1,1092,,8,rubet,r u b e t,,
4205,2,1092,,,ruðe:o:,r u ð e: o:,,
4206,2,1092,,,ruðe:eti,r u ð e: e t i,,
4207,1,1093,,11,ruber,r u b e r,,
4208,1,1093,,12,rubri:,r u b r i:,,
4209,2,1093,,,ruðros,r u ð r o s,,
4210,2,1093,,,ruðri:,r u ð r i:,,
4211,1,1094,,23,rubus,r u b u s,,
4212,2,1094,,,wruðos,w r u ð o s,,
4213,1,1095,,1,rumpo:,r u m p o:,,
4214,1,1095,,2,rumpit,r u m p i t,,
4215,2,1095,,,rumpo:,r u m p o:,,
4216,2,1095,,,rumpeti,r u m p e t i,,
4217,1,1096,,11,russus,r u s s u s,,
4218,1,1096,,12,russi:,r u s s i:,,
4219,2,1096,,,ruttos,r u t t o s,,
4220,2,1096,,,rutti:,r u t t i:,,
4221,1,1097,,1,ruo:,r u o:,,
4222,1,1097,,2,ruit,r u i t,,
4223,2,1097,,,rowo:,r o w o:,,
4224,2,1097,,,roweti,r o w e t i,,
4225,1,1098,188,11,ru:fus,r u: f u s,,
4226,1,1098,188,12,ru:fi:,r u: f i:,,
4227,2,1098,188,,rouðos,r o u ð o s,,
4228,2,1098,188,,rouði:,r o u ð i:,,
4229,1,1099,,36,ru:ga,r u: g a,,
4230,1,1099,,37,ru:gae,r u: g a e,,
4231,2,1099,,,rouga:,r o u g a:,,
4232,2,1099,,,rouga:i:,r o u g a: i:,,
4233,1,1100,189,5,ru:mor,r u: m o r,,
4234,1,1100,189,6,rumo:ris,r u m o: r i s,,
4235,2,1100,189,,roumo:s,r o u m o: s,,
4236,2,1100,189,,roumozes,r o u m o z e s,,
4237,1,1101,,15,ru:s,r u: s,,
4238,1,1101,,16,ru:ris,r u: r i s,,
4239,2,1101,,,rowos,r o w o s,,
4240,2,1101,,,rowozes,r o w o z e s,,
4241,1,1102,,11,ru:sticus,r u: s t i c u s,,
4242,1,1102,,12,ru:stici:,r u: s t i c i:,,
4243,2,1102,,,rowestikos,r o w e s t i k o s,,
4244,2,1102,,,rowestiki:,r o w e s t i k i:,,
4245,1,1103,190,19,sabulum,s a b u l u m,,
4246,1,1103,190,20,sabuli:,s a b u l i:,,
4247,2,1103,190,,psaðlom,p s a ð l o m,,
4248,2,1103,190,,psaðli:,p s a ð l i:,,
4249,1,1104,,11,sacer,s a c e r,,
4250,1,1104,,12,sacri:,s a c r i:,,
4251,2,1104,,,sakros,s a k r o s,,
4252,2,1104,,,sakri:,s a k r i:,,
4253,1,1105,,41,sacerdo:s,s a c e r d o: s,,
4254,1,1105,,42,sacerdo:tis,s a c e r d o: t i s,,
4255,2,1105,,,sakrodo:ts,s a k r o d o: t s,,
4256,2,1105,,,sakrodo:tes,s a k r o d o: t e s,,
4257,1,1106,,19,saeculum,s a e c u l u m,,
4258,1,1106,,20,saeculi:,s a e c u l i:,,
4259,2,1106,,,saitlom,s a i t l o m,,
4260,2,1106,,,saitli:,s a i t l i:,,
4261,1,1107,191,3,saepe:s,s a e p e: s,,
4262,1,1107,191,4,saepis,s a e p i s,,
4263,2,1107,191,,saipis,s a i p i s,,
4264,2,1107,191,,saepes,s a e p e s,,
4265,1,1108,,11,saevus,s a e v u s,,
4266,1,1108,,12,saevi:,s a e v i:,,
4267,2,1108,,,saiwos,s a i w o s,,
4268,2,1108,,,saevi:,s a e v i:,,
4269,1,1109,,36,saeta,s a e t a,,
4270,1,1109,,37,saetae,s a e t a e,,
4271,2,1109,,,saita:,s a i t a:,,
4272,2,1109,,,saeta:i:,s a e t a: i:,,
4273,1,1110,,36,salebra,s a l e b r a,,
4274,1,1110,,37,salebrae,s a l e b r a e,,
4275,2,1110,,,salesra:,s a l e s r a:,,
4276,2,1110,,,salebra:i:,s a l e b r a: i:,,
4277,1,1111,,38,salio:,s a l i o:,,
4278,1,1111,,39,salit,s a l i t,,
4279,2,1111,,,saljo:,s a l j o:,,
4280,2,1111,,,saljeti,s a l j e t i,,
4281,1,1112,,3,salix,s a l i x,,
4282,1,1112,,4,salicis,s a l i c i s,,
4283,2,1112,,,saliks,s a l i k s,,
4284,2,1112,,,salikes,s a l i k e s,,
4285,1,1113,,7,salveo:,s a l v e o:,,
4286,1,1113,,8,salvet,s a l v e t,,
4287,2,1113,,,saluwe:o:,s a l u w e: o:,,
4288,2,1113,,,saluwe:eti,s a l u w e: e t i,,
4289,1,1114,,11,salvus,s a l v u s,,
4290,1,1114,,12,salvi:,s a l v i:,,
4291,2,1114,,,saluwos,s a l u w o s,,
4292,2,1114,,,saluwi:,s a l u w i:,,
4293,1,1115,,38,sancio:,s a n c i o:,,
4294,1,1115,,39,sancit,s a n c i t,,
4295,2,1115,,,sankjo:,s a n k j o:,,
4296,2,1115,,,sankjeti,s a n k j e t i,,
4297,1,1116,,5,saŋguen,s a ŋ g u e n,,
4298,1,1116,,6,saŋguinis,s a ŋ g u i n i s,,
4299,2,1116,,,sangwen,s a n g w e n,,
4300,2,1116,,,sangwenes,s a n g w e n e s,,
4301,1,1117,,1,sapio:,s a p i o:,,
4302,1,1117,,2,sapit,s a p i t,,
4303,2,1117,,,sapjo:,s a p j o:,,
4304,2,1117,,,sapjeti,s a p j e t i,,
4305,1,1118,,38,sarcio:,s a r c i o:,,
4306,1,1118,,39,sarcit,s a r c i t,,
4307,2,1118,,,sarkjo:,s a r k j o:,,
4308,2,1118,,,sarkjeti,s a r k j e t i,,
4309,1,1119,192,1,sarpo:,s a r p o:,,
4310,1,1119,192,2,sarpit,s a r p i t,,
4311,2,1119,192,,serpo:,s e r p o:,,
4312,2,1119,192,,serpeti,s e r p e t i,,
4313,1,1120,,27,sarptus,s a r p t u s,,
4314,1,1120,,28,sarpti:,s a r p t i:,,
4315,2,1120,,,sarptom,s a r p t o m,,
4316,2,1120,,,sarpti:,s a r p t i:,,
4317,1,1121,,31,sat,s a t,,
4318,2,1121,,,sati,s a t i,,
4319,1,1122,,11,saucius,s a u c i u s,,
4320,1,1122,,12,saucii:,s a u c i i:,,
4321,2,1122,,,ksawakjos,k s a w a k j o s,,
4322,2,1122,,,ksawakji:,k s a w a k j i:,,
4323,1,1123,,19,saxum,s a x u m,,
4324,1,1123,,20,saxi:,s a x i:,,
4325,2,1123,,,saksom,s a k s o m,,
4326,2,1123,,,saksi:,s a k s i:,,
4327,1,1124,,38,sa:gio:,s a: g i o:,,
4328,2,1124,,,sa:gio:,s a: g i o:,,
4329,1,1125,,99,sa:l,s a: l,,
4330,1,1125,,100,salis,s a l i s,,
4331,2,1125,,,sa:ls,s a: l s,,
4332,2,1125,,,salos,s a l o s,,
4333,1,1126,,3,sa:nctio:,s a: n c t i o:,,
4334,2,1126,,,sa:nktjo:,s a: n k t j o:,,
4335,1,1127,,11,sa:nctus,s a: n c t u s,,
4336,1,1127,,12,sa:ncti:,s a: n c t i:,,
4337,2,1127,,,sa:nktos,s a: n k t o s,,
4338,2,1127,,,sa:nkti:,s a: n k t i:,,
4339,1,1128,,11,sa:nus,s a: n u s,,
4340,1,1128,,12,sa:ni:,s a: n i:,,
4341,2,1128,,,sa:nos,s a: n o s,,
4342,2,1128,,,sa:ni:,s a: n i:,,
4343,1,1129,,38,sa:rio:,s a: r i o:,,
4344,1,1129,,39,sa:rit,s a: r i t,,
4345,2,1129,,,sarsjo:,s a r s j o:,,
4346,2,1129,,,sarsjeti,s a r s j e t i,,
4347,1,1130,,19,scabellum,s c a b e l l u m,,
4348,1,1130,,20,scabelli:,s c a b e l l i:,,
4349,2,1130,,,skabnelom,s k a b n e l o m,,
4350,2,1130,,,skabneli:,s k a b n e l i:,,
4351,1,1131,,11,scaber,s c a b e r,,
4352,1,1131,,12,scabri:,s c a b r i:,,
4353,2,1131,,,skaβros,s k a β r o s,,
4354,2,1131,,,skaβri:,s k a β r i:,,
4355,1,1132,,1,scabo:,s c a b o:,,
4356,1,1132,,2,scabit,s c a b i t,,
4357,2,1132,,,skaβo:,s k a β o:,,
4358,2,1132,,,skaβeti,s k a β e t i,,
4359,1,1133,,11,scaevus,s c a e v u s,,
4360,1,1133,,12,scaevi:,s c a e v i:,,
4361,2,1133,,,skaiwos,s k a i w o s,,
4362,2,1133,,,skaiwi:,s k a i w i:,,
4363,1,1134,,19,scamnum,s c a m n u m,,
4364,1,1134,,20,scamni:,s c a m n i:,,
4365,2,1134,,,skamβnom,s k a m β n o m,,
4366,2,1134,,,skamβni:,s k a m β n i:,,
4367,1,1135,,1,scando:,s c a n d o:,,
4368,1,1135,,2,scandit,s c a n d i t,,
4369,2,1135,,,skando:,s k a n d o:,,
4370,2,1135,,,skandeti,s k a n d e t i,,
4371,1,1136,,36,scapula,s c a p u l a,,
4372,1,1136,,37,scapulae,s c a p u l a e,,
4373,2,1136,,,skapela:,s k a p e l a:,,
4374,2,1136,,,skapela:i:,s k a p e l a: i:,,
4375,1,1137,,36,sca:la,s c a: l a,,
4376,1,1137,,37,sca:lae,s c a: l a e,,
4377,2,1137,,,skandsla:,s k a n d s l a:,,
4378,2,1137,,,skandsla:i:,s k a n d s l a: i:,,
4379,1,1138,,15,scelus,s c e l u s,,
4380,1,1138,,16,sceleris,s c e l e r i s,,
4381,2,1138,,,skelos,s k e l o s,,
4382,2,1138,,,skelezes,s k e l e z e s,,
4383,1,1139,,56,scicidi:,s c i c i d i:,,
4384,2,1139,,,skiskidai,s k i s k i d a i,,
4385,1,1140,,1,scindo:,s c i n d o:,,
4386,1,1140,,2,scindit,s c i n d i t,,
4387,2,1140,,,skindo:,s k i n d o:,,
4388,2,1140,,,skindeti,s k i n d e t i,,
4389,1,1141,,38,scio:,s c i o:,,
4390,1,1141,,39,scit,s c i t,,
4391,2,1141,,,skijo:,s k i j o:,,
4392,2,1141,,,skijeti,s k i j e t i,,
4393,1,1142,,27,scissus,s c i s s u s,,
4394,1,1142,,28,scissi:,s c i s s i:,,
4395,2,1142,,,skidtos,s k i d t o s,,
4396,2,1142,,,skidti:,s k i d t i:,,
4397,1,1143,,19,scortum,s c o r t u m,,
4398,1,1143,,20,scorti:,s c o r t i:,,
4399,2,1143,,,skortom,s k o r t o m,,
4400,2,1143,,,skorti:,s k o r t i:,,
4401,1,1144,,1,scri:bo:,s c r i: b o:,,
4402,1,1144,,2,scri:bit,s c r i: b i t,,
4403,2,1144,,,skreiβo:,s k r e i β o:,,
4404,2,1144,,,skreiβeti,s k r e i β e t i,,
4405,1,1145,,27,scriptus,s c r i p t u s,,
4406,1,1145,,28,scripti:,s c r i p t i:,,
4407,2,1145,,,skriβtos,s k r i β t o s,,
4408,2,1145,,,skriβti:,s k r i β t i:,,
4409,1,1146,,5,scrobis,s c r o b i s,,
4410,1,1146,,6,scrobis,s c r o b i s,,
4411,2,1146,,,skroβis,s k r o β i s,,
4412,2,1146,,,skroβes,s k r o β e s,,
4413,1,1147,193,36,scro:fa,s c r o: f a,,
4414,1,1147,193,37,scro:fae,s c r o: f a e,,
4415,2,1147,193,,skro:βa:,s k r o: β a:,,
4416,2,1147,193,,skro:βa:i:,s k r o: β a: i:,,
4417,1,1148,,19,scu:tum,s c u: t u m,,
4418,1,1148,,20,scu:ti:,s c u: t i:,,
4419,2,1148,,,skoitom,s k o i t o m,,
4420,2,1148,,,skoiti:,s k o i t i:,,
4421,1,1149,,21,seco:,s e c o:,,
4422,1,1149,,22,secat,s e c a t,,
4423,2,1149,,,seka:jo:,s e k a: j o:,,
4424,2,1149,,,seka:jeti,s e k a: j e t i,,
4425,1,1150,,11,secundus,s e c u n d u s,,
4426,2,1150,,,sekʷontinos,s e kʷ o n t i n o s,,
4427,1,1151,,31,secus,s e c u s,,
4428,2,1151,,,sekwos,s e k w o s,,
4429,1,1152,,7,sedeo:,s e d e o:,,
4430,1,1152,,8,sedet,s e d e t,,
4431,2,1152,,,sede:o:,s e d e: o:,,
4432,2,1152,,,sede:eti,s e d e: e t i,,
4433,1,1153,,3,seges,s e g e s,,
4434,1,1153,,4,segetis,s e g e t i s,,
4435,2,1153,,,segets,s e g e t s,,
4436,2,1153,,,segetes,s e g e t e s,,
4437,1,1154,,36,sella,s e l l a,,
4438,1,1154,,37,sellae,s e l l a e,,
4439,2,1154,,,sedla:,s e d l a:,,
4440,2,1154,,,sedla:i:,s e d l a: i:,,
4441,1,1155,,48,senex,s e n e x,,
4442,1,1155,,49,senis,s e n i s,,
4443,2,1155,,,seneks,s e n e k s,,
4444,2,1155,,,senes,s e n e s,,
4445,1,1156,,38,sentio:,s e n t i o:,,
4446,1,1156,,39,sentit,s e n t i t,,
4447,2,1156,,,sentjo:,s e n t j o:,,
4448,2,1156,,,sentjeti,s e n t j e t i,,
4449,1,1157,,36,senti:na,s e n t i: n a,,
4450,1,1157,,37,senti:nae,s e n t i: n a e,,
4451,2,1157,,,semti:na,s e m t i: n a,,
4452,2,1157,,,semti:na:i:,s e m t i: n a: i:,,
4453,1,1158,,38,sepelio:,s e p e l i o:,,
4454,1,1158,,39,sepelit,s e p e l i t,,
4455,2,1158,,,sepeljo:,s e p e l j o:,,
4456,2,1158,,,sepeljeti,s e p e l j e t i,,
4457,1,1159,,46,septem,s e p t e m,,
4458,2,1159,,,septem,s e p t e m,,
4459,1,1160,194,5,september,s e p t e m b e r,,
4460,1,1160,194,6,septembris,s e p t e m b r i s,,
4461,2,1160,194,,septemome:nzris,s e p t e m o m e: n z r i s,,
4462,2,1160,194,,septemome:nzres,s e p t e m o m e: n z r e s,,
4463,1,1161,,11,sepultus,s e p u l t u s,,
4464,1,1161,,12,sepulti:,s e p u l t i:,,
4465,2,1161,,,sepeltus,s e p e l t u s,,
4466,2,1161,,,sepelti:,s e p e l t i:,,
4467,1,1162,,1,sequor,s e q u o r,,
4468,1,1162,,44,sequitur,s e q u i t u r,,
4469,2,1162,,,sekʷo:r,s e kʷ o: r,,
4470,2,1162,,,sekʷetor,s e kʷ e t o r,,
4471,1,1163,,11,sere:nus,s e r e: n u s,,
4472,1,1163,,12,sere:ni:,s e r e: n i:,,
4473,2,1163,,,ksere:nos,k s e r e: n o s,,
4474,2,1163,,,ksere:ni:,k s e r e: n i:,,
4475,1,1164,,1,sero:,s e r o:,,
4476,1,1164,,2,serit,s e r i t,,
4477,2,1164,,,sizo:,s i z o:,,
4478,2,1164,,,sizeti,s i z e t i,,
4479,1,1165,,1,sero:,s e r o:,,
4480,1,1165,,2,serit,s e r i t,,
4481,2,1165,,,sero:,s e r o:,,
4482,2,1165,,,serit,s e r i t,,
4483,1,1166,,1,serpo:,s e r p o:,,
4484,1,1166,,2,serpit,s e r p i t,,
4485,2,1166,,,serpo:,s e r p o:,,
4486,2,1166,,,serpeti,s e r p e t i,,
4487,1,1167,,36,serra,s e r r a,,
4488,1,1167,,37,serrae,s e r r a e,,
4489,2,1167,,,serza:,s e r z a:,,
4490,2,1167,,,serza:i:,s e r z a: i:,,
4491,1,1168,,21,servo:,s e r v o:,,
4492,1,1168,,22,servat,s e r v a t,,
4493,2,1168,,,serwa:jo:,s e r w a: j o:,,
4494,2,1168,,,serwa:jeti,s e r w a: j e t i,,
4495,1,1169,,23,servus,s e r v u s,,
4496,1,1169,,24,servi:,s e r v i:,,
4497,2,1169,,,serwos,s e r w o s,,
4498,2,1169,,,serwi:,s e r w i:,,
4499,1,1170,,11,seve:rus,s e v e: r u s,,
4500,1,1170,,12,seve:ri:,s e v e: r i:,,
4501,2,1170,,,seɣwe:ros,s e ɣ w e: r o s,,
4502,2,1170,,,seɣwe:ri:,s e ɣ w e: r i:,,
4503,1,1171,,46,sex,s e x,,
4504,2,1171,,,seks,s e k s,,
4505,1,1172,,17,sexus,s e x u s,,
4506,2,1172,,,seksus,s e k s u s,,
4507,1,1173,,21,se:do:,s e: d o:,,
4508,2,1173,,,sede:o:,s e d e: o:,,
4509,1,1174,,25,se:ŋnis,s e: ŋ n i s,,
4510,1,1174,,26,se:ŋnis,s e: ŋ n i s,,
4511,2,1174,,,se:gnis,s e: g n i s,,
4512,2,1174,,,se:gnes,s e: g n e s,,
4513,1,1175,,15,se:men,s e: m e n,,
4514,2,1175,,,se:men,s e: m e n,,
4515,1,1176,,36,se:mita,s e: m i t a,,
4516,2,1176,,,se:mita:,s e: m i t a:,,
4517,1,1177,,11,se:rius,s e: r i u s,,
4518,1,1177,,12,se:rii:,s e: r i i:,,
4519,2,1177,,,swerjos,s w e r j o s,,
4520,2,1177,,,se:rjos,s e: r j o s,,
4521,2,1177,,,swerji:,s w e r j i:,,
4522,2,1177,,,se:rji:,s e: r j i:,,
4523,1,1178,,11,se:rus,s e: r u s,,
4524,1,1178,,12,se:ri:,s e: r i:,,
4525,2,1178,,,se:ros,s e: r o s,,
4526,2,1178,,,se:ri:,s e: r i:,,
4527,1,1179,,81,se:tius,s e: t i u s,,
4528,2,1179,,,se:tjos,s e: t j o s,,
4529,1,1180,195,11,siccus,s i c c u s,,
4530,1,1180,195,12,sicci:,s i c c i:,,
4531,2,1180,195,,siskwos,s i s k w o s,,
4532,2,1180,195,,siskwi:,s i s k w i:,,
4533,1,1181,,7,sileo:,s i l e o:,,
4534,1,1181,,8,silet,s i l e t,,
4535,2,1181,,,sile:o:,s i l e: o:,,
4536,2,1181,,,sile:eti,s i l e: e t i,,
4537,1,1182,,19,siŋnum,s i ŋ n u m,,
4538,1,1182,,20,siŋni:,s i ŋ n i:,,
4539,2,1182,,,seknom,s e k n o m,,
4540,2,1182,,,sekni:,s e k n i:,,
4541,1,1183,,25,similis,s i m i l i s,,
4542,1,1183,,26,similis,s i m i l i s,,
4543,2,1183,,,semalis,s e m a l i s,,
4544,2,1183,,,semales,s e m a l e s,,
4545,1,1184,,48,simplex,s i m p l e x,,
4546,1,1184,,49,simplicis,s i m p l i c i s,,
4547,2,1184,,,semplaks,s e m p l a k s,,
4548,2,1184,,,semplakes,s e m p l a k e s,,
4549,1,1185,196,11,since:rus,s i n c e: r u s,,
4550,1,1185,196,12,since:ri:,s i n c e: r i:,,
4551,2,1185,196,,senkairos,s e n k a i r o s,,
4552,2,1185,196,,senkairi:,s e n k a i r i:,,
4553,1,1186,,101,siŋguli:,s i ŋ g u l i:,,
4554,2,1186,,,semɣeloi,s e m ɣ e l o i,,
4555,1,1187,,17,siŋgultus,s i ŋ g u l t u s,,
4556,1,1187,,18,siŋgultu:s,s i ŋ g u l t u: s,,
4557,2,1187,,,sengwoltus,s e n g w o l t u s,,
4558,2,1187,,,sengwoltuos,s e n g w o l t u o s,,
4559,1,1188,,11,siŋgulus,s i ŋ g u l u s,,
4560,2,1188,,,semɣelos,s e m ɣ e l o s,,
4561,1,1189,,11,sinister,s i n i s t e r,,
4562,1,1189,,12,sinistri:,s i n i s t r i:,,
4563,2,1189,,,senisteros,s e n i s t e r o s,,
4564,2,1189,,,senisteri:,s e n i s t e r i:,,
4565,1,1190,,1,sino:,s i n o:,,
4566,1,1190,,2,sinit,s i n i t,,
4567,2,1190,,,sino:,s i n o:,,
4568,2,1190,,,sineti,s i n e t i,,
4569,1,1191,,17,sinus,s i n u s,,
4570,1,1191,,18,sinu:s,s i n u: s,,
4571,2,1191,,,sinus,s i n u s,,
4572,2,1191,,,sinwos,s i n w o s,,
4573,1,1192,,1,sisto:,s i s t o:,,
4574,1,1192,,2,sistit,s i s t i t,,
4575,2,1192,,,sisto:,s i s t o:,,
4576,2,1192,,,sisteti,s i s t e t i,,
4577,1,1193,,3,sitis,s i t i s,,
4578,1,1193,,4,sitis,s i t i s,,
4579,2,1193,,,ksitis,k s i t i s,,
4580,2,1193,,,ksites,k s i t e s,,
4581,1,1194,,35,si:,s i:,,
4582,2,1194,,,sei,s e i,,
4583,1,1195,,1,si:do:,s i: d o:,,
4584,1,1195,,2,si:dit,s i: d i t,,
4585,2,1195,,,sizdo:,s i z d o:,,
4586,2,1195,,,sizdeti,s i z d e t i,,
4587,1,1196,,15,si:dus,s i: d u s,,
4588,1,1196,,16,si:deris,s i: d e r i s,,
4589,2,1196,,,si:ðos,s i: ð o s,,
4590,2,1196,,,si:ðeres,s i: ð e r e s,,
4591,1,1197,,5,socer,s o c e r,,
4592,1,1197,,6,soceri:,s o c e r i:,,
4593,2,1197,,,swekuros,s w e k u r o s,,
4594,2,1197,,,swekuri:,s w e k u r i:,,
4595,1,1198,,23,socius,s o c i u s,,
4596,1,1198,,24,socii:,s o c i i:,,
4597,2,1198,,,sokjos,s o k j o s,,
4598,2,1198,,,sokji:,s o k j i:,,
4599,1,1199,,13,socrus,s o c r u s,,
4600,1,1199,,14,socru:s,s o c r u: s,,
4601,2,1199,,,swekrus,s w e k r u s,,
4602,2,1199,,,swekru:,s w e k r u:,,
4603,2,1199,,,swekrous,s w e k r o u s,,
4604,2,1199,,,swekrous,s w e k r o u s,,
4605,1,1200,,41,soda:lis,s o d a: l i s,,
4606,1,1200,,42,soda:lis,s o d a: l i s,,
4607,2,1200,,,sweða:lis,s w e ð a: l i s,,
4608,2,1200,,,sweða:les,s w e ð a: l e s,,
4609,1,1201,,7,soleo:,s o l e o:,,
4610,1,1201,,8,solet,s o l e t,,
4611,2,1201,,,solejo:,s o l e j o:,,
4612,2,1201,,,solejeti,s o l e j e t i,,
4613,1,1202,,11,solidus,s o l i d u s,,
4614,1,1202,,12,solidi:,s o l i d i:,,
4615,2,1202,,,soliðos,s o l i ð o s,,
4616,2,1202,,,soliði:,s o l i ð i:,,
4617,1,1203,197,19,solium,s o l i u m,,
4618,1,1203,197,20,soli:,s o l i:,,
4619,2,1203,197,,sodjom,s o d j o m,,
4620,2,1203,197,,sodji:,s o d j i:,,
4621,1,1204,,11,sollus,s o l l u s,,
4622,1,1204,,12,solli:,s o l l i:,,
4623,2,1204,,,solnos,s o l n o s,,
4624,2,1204,,,solni:,s o l n i:,,
4625,1,1205,,19,solum,s o l u m,,
4626,1,1205,,20,soli:,s o l i:,,
4627,2,1205,,,solom,s o l o m,,
4628,2,1205,,,soli:,s o l i:,,
4629,1,1206,,1,solvo:,s o l v o:,,
4630,1,1206,,2,solvit,s o l v i t,,
4631,2,1206,,,seluwo:,s e l u w o:,,
4632,2,1206,,,seluweti,s e l u w e t i,,
4633,1,1207,,23,somnus,s o m n u s,,
4634,1,1207,,24,somni:,s o m n i:,,
4635,2,1207,,,swepnos,s w e p n o s,,
4636,2,1207,,,swepni:,s w e p n i:,,
4637,1,1208,,21,sono:,s o n o:,,
4638,1,1208,,22,sonat,s o n a t,,
4639,2,1208,,,swona:jo:,s w o n a: j o:,,
4640,2,1208,,,swona:jeti,s w o n a: j e t i,,
4641,1,1209,198,5,sopor,s o p o r,,
4642,1,1209,198,6,sopo:ris,s o p o: r i s,,
4643,2,1209,198,,swepo:s,s w e p o: s,,
4644,2,1209,198,,swepores,s w e p o r e s,,
4645,1,1210,,7,sorbeo:,s o r b e o:,,
4646,1,1210,,8,sorbet,s o r b e t,,
4647,2,1210,,,sorβejo:,s o r β e j o:,,
4648,2,1210,,,sorβejeti,s o r β e j e t i,,
4649,1,1211,,7,sordeo:,s o r d e o:,,
4650,1,1211,,8,sordet,s o r d e t,,
4651,2,1211,,,swerde:o:,s w e r d e: o:,,
4652,2,1211,,,swerde:eti,s w e r d e: e t i,,
4653,1,1212,199,3,sorde:s,s o r d e: s,,
4654,1,1212,199,4,sordis,s o r d i s,,
4655,2,1212,199,,swerdis,s w e r d i s,,
4656,2,1212,199,,swerdes,s w e r d e s,,
4657,1,1213,200,3,soror,s o r o r,,
4658,1,1213,200,4,soro:ris,s o r o: r i s,,
4659,2,1213,200,,swezo:r,s w e z o: r,,
4660,2,1213,200,,swezo:res,s w e z o: r e s,,
4661,1,1214,,3,sors,s o r s,,
4662,1,1214,,4,sortis,s o r t i s,,
4663,2,1214,,,sortis,s o r t i s,,
4664,2,1214,,,sortes,s o r t e s,,
4665,1,1215,,48,sospes,s o s p e s,,
4666,1,1215,,49,sospitis,s o s p i t i s,,
4667,2,1215,,,swespats,s w e s p a t s,,
4668,2,1215,,,swespates,s w e s p a t e s,,
4669,1,1216,201,11,so:brius,s o: b r i u s,,
4670,1,1216,201,12,so:brii:,s o: b r i i:,,
4671,2,1216,201,,sweobrios,s w e o b r i o s,,
4672,2,1216,201,,sweobrii:,s w e o b r i i:,,
4673,1,1217,,23,so:bri:nus,s o: b r i: n u s,,
4674,1,1217,,24,so:bri:ni:,s o: b r i: n i:,,
4675,2,1217,,,swezri:nos,s w e z r i: n o s,,
4676,2,1217,,,swezri:ni:,s w e z r i: n i:,,
4677,1,1218,202,5,so:l,s o: l,,
4678,2,1218,202,,saul,s a u l,,
4679,1,1219,203,11,so:lus,s o: l u s,,
4680,2,1219,203,,swelos,s w e l o s,,
4681,1,1220,,48,so:ns,s o: n s,,
4682,1,1220,,49,sontis,s o n t i s,,
4683,2,1220,,,sonts,s o n t s,,
4684,2,1220,,,sontes,s o n t e s,,
4685,1,1221,,1,spargo:,s p a r g o:,,
4686,1,1221,,2,spargit,s p a r g i t,,
4687,2,1221,,,spargo:,s p a r g o:,,
4688,2,1221,,,spargeti,s p a r g e t i,,
4689,1,1222,,56,sparsi:,s p a r s i:,,
4690,2,1222,,,spargsai,s p a r g s a i,,
4691,1,1223,,1,specio:,s p e c i o:,,
4692,1,1223,,2,specit,s p e c i t,,
4693,2,1223,,,spekjo:,s p e k j o:,,
4694,2,1223,,,spekjeti,s p e k j e t i,,
4695,1,1224,,1,sperno:,s p e r n o:,,
4696,1,1224,,2,spernit,s p e r n i t,,
4697,2,1224,,,sperno:,s p e r n o:,,
4698,2,1224,,,sperneti,s p e r n e t i,,
4699,1,1225,,60,spe:s,s p e: s,,
4700,2,1225,,,spe:s,s p e: s,,
4701,1,1226,,36,spi:ca,s p i: c a,,
4702,1,1226,,37,spi:cae,s p i: c a e,,
4703,2,1226,,,speika:,s p e i k a:,,
4704,2,1226,,,speika:i:,s p e i k a: i:,,
4705,1,1227,,36,spi:na,s p i: n a,,
4706,1,1227,,37,spi:nae,s p i: n a e,,
4707,2,1227,,,speina:,s p e i n a:,,
4708,2,1227,,,speina:i:,s p e i n a: i:,,
4709,1,1228,,21,spi:ro:,s p i: r o:,,
4710,1,1228,,22,spi:rat,s p i: r a t,,
4711,2,1228,,,speiza:jo:,s p e i z a: j o:,,
4712,2,1228,,,speiza:jeti,s p e i z a: j e t i,,
4713,1,1229,,11,spissus,s p i s s u s,,
4714,1,1229,,12,spissi:,s p i s s i:,,
4715,2,1229,,,spidtos,s p i d t o s,,
4716,2,1229,,,spidti:,s p i d t i:,,
4717,1,1230,,36,sponda,s p o n d a,,
4718,1,1230,,37,spondae,s p o n d a e,,
4719,2,1230,,,sponda:,s p o n d a:,,
4720,2,1230,,,sponda:i:,s p o n d a: i:,,
4721,1,1231,,7,spondeo:,s p o n d e o:,,
4722,1,1231,,8,spondet,s p o n d e t,,
4723,2,1231,,,spondejo:,s p o n d e j o:,,
4724,2,1231,,,spondejeti,s p o n d e j e t i,,
4725,1,1232,204,40,spopondi:,s p o p o n d i:,,
4726,2,1232,204,,spespondai,s p e s p o n d a i,,
4727,1,1233,,31,sponte,s p o n t e,,
4728,2,1233,,,sponti,s p o n t i,,
4729,1,1234,,102,spo:nsum,s p o: n s u m,,
4730,1,1234,,103,spo:nsi:,s p o: n s i:,,
4731,2,1234,,,spondtom,s p o n d t o m,,
4732,2,1234,,,spondti:,s p o n d t i:,,
4733,1,1235,,1,spuo:,s p u o:,,
4734,1,1235,,2,spuit,s p u i t,,
4735,2,1235,,,spujo:,s p u j o:,,
4736,2,1235,,,spujeti,s p u j e t i,,
4737,1,1236,,11,spurcus,s p u r c u s,,
4738,2,1236,,,sporkos,s p o r k o s,,
4739,1,1237,,36,spu:ma,s p u: m a,,
4740,1,1237,,37,spu:mae,s p u: m a e,,
4741,2,1237,,,spoima:,s p o i m a:,,
4742,2,1237,,,spoima:i:,s p o i m a: i:,,
4743,1,1238,,19,stabulum,s t a b u l u m,,
4744,1,1238,,20,stabuli:,s t a b u l i:,,
4745,2,1238,,,staðlom,s t a ð l o m,,
4746,2,1238,,,staðli:,s t a ð l i:,,
4747,1,1239,,15,sta:men,s t a: m e n,,
4748,1,1239,,16,sta:minis,s t a: m i n i s,,
4749,2,1239,,,sta:men,s t a: m e n,,
4750,2,1239,,,stamenes,s t a m e n e s,,
4751,1,1240,,15,stercus,s t e r c u s,,
4752,1,1240,,16,stecoris,s t e c o r i s,,
4753,2,1240,,,sterkos,s t e r k o s,,
4754,2,1240,,,sterkores,s t e r k o r e s,,
4755,1,1241,,1,sterno:,s t e r n o:,,
4756,1,1241,,2,sternit,s t e r n i t,,
4757,2,1241,,,sterno:,s t e r n o:,,
4758,2,1241,,,sterneti,s t e r n e t i,,
4759,1,1242,,1,sternuo:,s t e r n u o:,,
4760,1,1242,,2,sternuit,s t e r n u i t,,
4761,2,1242,,,psternuwo:,p s t e r n u w o:,,
4762,2,1242,,,psternuweti,p s t e r n u w e t i,,
4763,1,1243,,36,ste:lla,s t e: l l a,,
4764,1,1243,,37,ste:llae,s t e: l l a e,,
4765,2,1243,,,ste:rola:,s t e: r o l a:,,
4766,2,1243,,,ste:rola:i:,s t e: r o l a: i:,,
4767,1,1244,,1,stiŋguo:,s t i ŋ g u o:,,
4768,1,1244,,2,stiŋguit,s t i ŋ g u i t,,
4769,2,1244,,,stengwo:,s t e n g w o:,,
4770,2,1244,,,stengweti,s t e n g w e t i,,
4771,1,1245,,36,sti:lla,s t i: l l a,,
4772,1,1245,,37,sti:llae,s t i: l l a e,,
4773,2,1245,,,steirla:,s t e i r l a:,,
4774,2,1245,,,steirla:i:,s t e i r l a: i:,,
4775,1,1246,,5,stips,s t i p s,,
4776,1,1246,,6,stipis,s t i p i s,,
4777,2,1246,,,stips,s t i p s,,
4778,2,1246,,,stipes,s t i p e s,,
4779,1,1247,,36,stipula,s t i p u l a,,
4780,1,1247,,37,stipulae,s t i p u l a e,,
4781,2,1247,,,stipela:,s t i p e l a:,,
4782,2,1247,,,stipela:i:,s t i p e l a: i:,,
4783,1,1248,,21,sti:po:,s t i: p o:,,
4784,1,1248,,22,sti:pat,s t i: p a t,,
4785,2,1248,,,steipa:jo:,s t e i p a: j o:,,
4786,2,1248,,,steipa:jeti,s t e i p a: j e t i,,
4787,1,1249,,5,stolo:,s t o l o:,,
4788,1,1249,,6,stolo:nis,s t o l o: n i s,,
4789,2,1249,,,stelo:,s t e l o:,,
4790,2,1249,,,stelo:nes,s t e l o: n e s,,
4791,1,1250,,21,sto:,s t o:,,
4792,1,1250,,22,stat,s t a t,,
4793,2,1250,,,stae:o:,s t a e: o:,,
4794,2,1250,,,stae:eti,s t a e: e t i,,
4795,1,1251,,27,stra:tus,s t r a: t u s,,
4796,1,1251,,28,stra:ti:,s t r a: t i:,,
4797,2,1251,,,stra:tos,s t r a: t o s,,
4798,2,1251,,,stra:ti:,s t r a: t i:,,
4799,1,1252,,1,strepo:,s t r e p o:,,
4800,1,1252,,2,strepit,s t r e p i t,,
4801,2,1252,,,strepo:,s t r e p o:,,
4802,2,1252,,,strepeti,s t r e p e t i,,
4803,1,1253,,36,stria,s t r i a,,
4804,1,1253,,37,striae,s t r i a e,,
4805,2,1253,,,strigja:,s t r i g j a:,,
4806,2,1253,,,strigja:i:,s t r i g j a: i:,,
4807,1,1254,,1,striŋgo:,s t r i ŋ g o:,,
4808,1,1254,,2,striŋgit,s t r i ŋ g i t,,
4809,2,1254,,,stringo:,s t r i n g o:,,
4810,2,1254,,,stringeti,s t r i n g e t i,,
4811,1,1255,,1,struo:,s t r u o:,,
4812,1,1255,,2,struit,s t r u i t,,
4813,2,1255,,,strowo:,s t r o w o:,,
4814,2,1255,,,stroweti,s t r o w e t i,,
4815,1,1256,,11,stultus,s t u l t u s,,
4816,1,1256,,12,stulti:,s t u l t i:,,
4817,2,1256,,,stoltos,s t o l t o s,,
4818,2,1256,,,stolti:,s t o l t i:,,
4819,1,1257,,7,stupeo:,s t u p e o:,,
4820,1,1257,,8,stupet,s t u p e t,,
4821,2,1257,,,stupe:o:,s t u p e: o:,,
4822,2,1257,,,stupe:eti,s t u p e: e t i,,
4823,1,1258,,23,sturnus,s t u r n u s,,
4824,1,1258,,24,struni:,s t r u n i:,,
4825,2,1258,,,stornos,s t o r n o s,,
4826,2,1258,,,storni:,s t o r n i:,,
4827,1,1259,,7,sua:deo:,s u a: d e o:,,
4828,1,1259,,8,sua:det,s u a: d e t,,
4829,2,1259,,,swa:dejo:,s w a: d e j o:,,
4830,2,1259,,,swadejeti,s w a d e j e t i,,
4831,1,1260,,19,sua:sum,s u a: s u m,,
4832,1,1260,,20,sua:si:,s u a: s i:,,
4833,2,1260,,,swarssom,s w a r s s o m,,
4834,2,1260,,,swarssi:,s w a r s s i:,,
4835,1,1261,,25,sua:vis,s u a: v i s,,
4836,1,1261,,26,sua:vis,s u a: v i s,,
4837,2,1261,,,swa:dwis,s w a: d w i s,,
4838,2,1261,,,swadwes,s w a d w e s,,
4839,1,1262,,0,sub,s u b,,
4840,2,1262,,,supo,s u p o,,
4841,1,1263,,19,subliga:culum,s u b l i g a: c u l u m,,
4842,2,1263,,,supoleigaklom,s u p o l e i g a k l o m,,
4843,1,1264,,1,sue:sco:,s u e: s c o:,,
4844,1,1264,,2,sue:scit,s u e: s c i t,,
4845,2,1264,,,sweðsko:,s w e ð s k o:,,
4846,2,1264,,,sweðsketi,s w e ð s k e t i,,
4847,1,1265,205,38,suffio:,s u f f i o:,,
4848,1,1265,205,39,suffit,s u f f i t,,
4849,2,1265,205,,supoðu:jo:,s u p o ð u: j o:,,
4850,2,1265,205,,supoðu:jeti,s u p o ð u: j e t i,,
